{
  "$schema": "https://uofa.net/schemas/pack-manifest/v1.json",
  "name": "model-credibility",
  "version": "0.2.0",
  "description": "Model credibility: NIST AI RMF model-card documentation completeness (Group A, 17 presence-only factors grouped by GOVERN/MAP/MEASURE/MANAGE) plus NIST AI 800-3 evaluation sufficiency (Group B, 6 factors assessing a reported benchmark result as validation evidence, the way vv40 assesses a simulation validation study). Presence-only throughout, no risk tiers and no 1-5 levels. The two groups are firewalled: each group's shapes are gated on a required factorStandard match, and every Group-B rule binds hasValidationResult, so neither group's weakeners can fire on the other's absent inputs.",
  "standards": [
    "NIST-AI-RMF-1.0",
    "NIST-AI-800-3",
    "ASME-VV40-2018"
  ],
  "author": "Vishnu Vettrivel",
  "license": "Apache-2.0",
  "coreCompatibility": ">=0.5.0",
  "prompt": "prompts/model_credibility_extract_prompt.txt",
  "factors": 23,
  "capabilities": [
    {
      "leg": "detection",
      "capabilityId": "detection:model-credibility-factors",
      "targetInterface": "detection",
      "interfaceVersion": "1.0",
      "firewallPlacement": "measurement-region",
      "provenance": {
        "stampsPackVersion": true
      },
      "payload": {
        "shapes": "shapes/model_credibility_shapes.ttl",
        "rules": "rules/model_credibility_weakener.rules",
        "patternIds": [
          "W-EV-GEN-02",
          "W-EV-DET-03",
          "W-EV-NULL-04",
          "W-EV-COU-05",
          "W-EV-CAP-06",
          "COMPOUND-EV-01",
          "COMPOUND-EV-02",
          "W-EV-SUB-08",
          "W-EV-COR-09",
          "W-EV-DIV-07"
        ],
        "oos": {
          "enabled": false,
          "rule_files": []
        },
        "factorFocus": {
          "W-ON-02": [
            "Out-of-scope use"
          ],
          "W-AL-01": [
            "Evaluation metrics",
            "Score and uncertainty"
          ],
          "W-AR-05": [
            "Evaluation methodology"
          ],
          "W-EV-GEN-02": [
            "Item sampling"
          ],
          "W-EV-DET-03": [
            "Harness determinism"
          ],
          "W-EV-NULL-04": [
            "Null calibration"
          ],
          "W-EV-COU-05": [
            "Context-of-use relevance"
          ],
          "W-EV-CAP-06": [
            "Construct validity"
          ],
          "COMPOUND-EV-01": [
            "Score and uncertainty",
            "Null calibration"
          ],
          "COMPOUND-EV-02": [
            "Item sampling"
          ],
          "W-EV-SUB-08": [
            "Harness determinism"
          ],
          "W-EV-COR-09": [
            "Score and uncertainty"
          ],
          "W-EV-DIV-07": [
            "Score and uncertainty"
          ]
        }
      }
    }
  ]
}
