{
  "name": "nasa-7009b",
  "version": "0.5.0",
  "description": "NASA-STD-7009B credibility assessment factors (19 factors: 13 shared with V&V 40 + 6 NASA-only).",
  "standards": ["NASA-STD-7009B"],
  "shapes": "shapes/nasa_7009b_shapes.ttl",
  "rules": "rules/nasa_7009b_weakener.rules",
  "template": "templates/nasa-7009b-template.xlsx",
  "prompt": "prompts/nasa_7009b_extract_prompt.txt",
  "factors": 19,
  "weakener_patterns": 6,
  "author": "Vishnu Vettrivel",
  "license": "Apache-2.0"
}
