{
  "name": "vv40_oos_enabled",
  "version": "0.1.0",
  "description": "Test fixture pack — V&V 40 with OOS enabled by default. Used by the §5.6 'pack config path' gating test in tests/oos/test_production_oos.py. Not a production pack.",
  "standards": ["ASME-VV40-2018"],
  "shapes": "shapes/vv40_shapes.ttl",
  "rules": null,
  "factors": 13,
  "weakener_patterns": 0,
  "author": "Vishnu Vettrivel",
  "license": "Apache-2.0",
  "oos": {
    "enabled": true,
    "rule_files": ["rules/oos/oos_v0.1.rules"]
  }
}
